{
  "schema_version": "1.0.0",
  "session_id": "20260808_143749_5f0512_chapter2.1.3",
  "chapter": "2.1.3",
  "mode": "practice",
  "created_at": "2026-08-08T14:37:49.361022",
  "updated_at": "2026-08-08T14:37:49.366623",
  "status": "in_progress",
  "template_file": "/Users/air/Downloads/GUIDE_AI_3/人工智能训练师_3级_sucai/template/2.1.3/2.1.3.ipynb",
  "practice_file": "practice.ipynb"
}