{
  "schema_version": "1.0.0",
  "session_id": "20260823_154546_6bf00c_chapter2.1.1",
  "chapter": "2.1.1",
  "mode": "practice",
  "created_at": "2026-08-23T15:45:46.648572",
  "updated_at": "2026-08-23T15:45:46.667306",
  "status": "in_progress",
  "template_file": "template/2.1.1/2.1.1.ipynb",
  "practice_file": "practice.ipynb"
}