{
  "schema_version": "1.0.0",
  "session_id": "20260808_000849_f1634b_chapter2.1.1",
  "chapter": "2.1.1",
  "mode": "practice",
  "created_at": "2026-08-08T00:08:49.925680",
  "updated_at": "2026-08-08T00:08:49.930269",
  "status": "in_progress",
  "template_file": "/Users/air/Downloads/GUIDE_AI_3/人工智能训练师_3级_sucai/2.1.1-materials/2.1.1.ipynb",
  "practice_file": "practice.ipynb"
}